<?xml version="1.0" encoding="UTF-8"?>
<!--Sample XML file generated by XMLSpy v2008 sp1 (http://www.altova.com)-->
<LoadingListReport xsi:noNamespaceSchemaLocation="LoadingList.xsd" xmlns:xsi="http://www.w3.org/2001/XMLSchema-instance">
	<MetaData terminalIdentity="aaaaaaaaaaaaaaaaaaaaaaaaaaaaaaaaaaa" documentType="text" numberOfCopies="127" documentSubType="text" userIdentity="aaaaaaaa" applicationIdentity="aaaaaaaaaaaaaaaaaaaaaaaaaaaaaaaaaaa" printerIdentity="aaaaaaaaaaaaaaaaaaaaaaaaaaaaaaaaaaa" isCopy="true"/>
	<Data>
		<LoadingList>
			<Departure WarehouseName="aaaaaaaaaaaaaaaaaaaaaaaaa" RouteId="aaaaaaaaaaaaaaaaa" DepartureId="aaaaaaaaaaaaaaaaaaaaaaaaaaaaaaaaaaa" RouteDescription="aaaaaaaaaaaaaaaaaaaaaaaaaaaaaaaaaaa" PlannedDepartureTime="2001-12-17T09:30:47.0Z">
				<LoadCarrier ShipLocationAddress="aaaaaaaaaaaa" Address2="aaaaaaaaaaaaaaaaaaaaaaaaaaaaaaaaaaa" AreaIdentity="aaa" LocationAddress="aaaaaaaaaaaa" TotalVolume="1234567891.123456" Phone="aaaaaaaaaaaaaaaaaaaaaaaaaaaaaaaaaaa" LoadCarrierTypeDescription="aaaaaaaaaaaaaaaaaaaaaaaaaaaaaaaaaaa" ShipAreaIdentity="aaa" City="aaaaaaaaaaaaaaaaaaaaaaaaaaaaaaaaaaa" Address="aaaaaaaaaaaaaaaaaaaaaaaaaaaaaaaaaaa" Name="aaaaaaaaaaaaaaaaaaaaaaaaaaaaaaaaaaa" LoadCarrierIdentity="aaaaaaaaaaaaaaaaaaaaaaaaaaaaaaaaaaa" PartyIdentity="aaaaaaaaaaaaaaaaaaaaaaaaaaaaaaaaaaa" ZipCode="aaaaaaaaaaaa" TotalWeight="1234567891.123456" StopSequence="12345" EstimatedArrivalTime="2001-12-17T09:30:47.0Z" ProductTransportTypeText="aaaaaaaaaaaaaaaaaaaaaaaaaaaaaaaaaaa" ParentLoadCarrierIdentity="aaaaaaaaaaaaaaaaaaaaaaaaaaaaaaaaaaa"/>
				<LoadCarrier ShipLocationAddress="aaaaaaaaaaaa" Address2="aaaaaaaaaaaaaaaaaaaaaaaaaaaaaaaaaaa" AreaIdentity="aaa" LocationAddress="aaaaaaaaaaaa" TotalVolume="1234567891.123456" Phone="aaaaaaaaaaaaaaaaaaaaaaaaaaaaaaaaaaa" LoadCarrierTypeDescription="aaaaaaaaaaaaaaaaaaaaaaaaaaaaaaaaaaa" ShipAreaIdentity="aaa" City="aaaaaaaaaaaaaaaaaaaaaaaaaaaaaaaaaaa" Address="aaaaaaaaaaaaaaaaaaaaaaaaaaaaaaaaaaa" Name="aaaaaaaaaaaaaaaaaaaaaaaaaaaaaaaaaaa" LoadCarrierIdentity="aaaaaaaaaaaaaaaaaaaaaaaaaaaaaaaaaaa" PartyIdentity="aaaaaaaaaaaaaaaaaaaaaaaaaaaaaaaaaaa" ZipCode="aaaaaaaaaaaa" TotalWeight="1234567891.123456" StopSequence="12345" EstimatedArrivalTime="2001-12-17T09:30:47.0Z" ProductTransportTypeText="aaaaaaaaaaaaaaaaaaaaaaaaaaaaaaaaaaa" ParentLoadCarrierIdentity="aaaaaaaaaaaaaaaaaaaaaaaaaaaaaaaaaaa"/>
				<LoadCarrier ShipLocationAddress="aaaaaaaaaaaa" Address2="aaaaaaaaaaaaaaaaaaaaaaaaaaaaaaaaaaa" AreaIdentity="aaa" LocationAddress="aaaaaaaaaaaa" TotalVolume="1234567891.123456" Phone="aaaaaaaaaaaaaaaaaaaaaaaaaaaaaaaaaaa" LoadCarrierTypeDescription="aaaaaaaaaaaaaaaaaaaaaaaaaaaaaaaaaaa" ShipAreaIdentity="aaa" City="aaaaaaaaaaaaaaaaaaaaaaaaaaaaaaaaaaa" Address="aaaaaaaaaaaaaaaaaaaaaaaaaaaaaaaaaaa" Name="aaaaaaaaaaaaaaaaaaaaaaaaaaaaaaaaaaa" LoadCarrierIdentity="aaaaaaaaaaaaaaaaaaaaaaaaaaaaaaaaaaa" PartyIdentity="aaaaaaaaaaaaaaaaaaaaaaaaaaaaaaaaaaa" ZipCode="aaaaaaaaaaaa" TotalWeight="1234567891.123456" StopSequence="12345" EstimatedArrivalTime="2001-12-17T09:30:47.0Z" ProductTransportTypeText="aaaaaaaaaaaaaaaaaaaaaaaaaaaaaaaaaaa" ParentLoadCarrierIdentity="aaaaaaaaaaaaaaaaaaaaaaaaaaaaaaaaaaa"/>
				<LoadCarrier ShipLocationAddress="aaaaaaaaaaaa" Address2="aaaaaaaaaaaaaaaaaaaaaaaaaaaaaaaaaaa" AreaIdentity="aaa" LocationAddress="aaaaaaaaaaaa" TotalVolume="1234567891.123456" Phone="aaaaaaaaaaaaaaaaaaaaaaaaaaaaaaaaaaa" LoadCarrierTypeDescription="aaaaaaaaaaaaaaaaaaaaaaaaaaaaaaaaaaa" ShipAreaIdentity="aaa" City="aaaaaaaaaaaaaaaaaaaaaaaaaaaaaaaaaaa" Address="aaaaaaaaaaaaaaaaaaaaaaaaaaaaaaaaaaa" Name="aaaaaaaaaaaaaaaaaaaaaaaaaaaaaaaaaaa" LoadCarrierIdentity="aaaaaaaaaaaaaaaaaaaaaaaaaaaaaaaaaaa" PartyIdentity="aaaaaaaaaaaaaaaaaaaaaaaaaaaaaaaaaaa" ZipCode="aaaaaaaaaaaa" TotalWeight="1234567891.123456" StopSequence="12345" EstimatedArrivalTime="2001-12-17T09:30:47.0Z" ProductTransportTypeText="aaaaaaaaaaaaaaaaaaaaaaaaaaaaaaaaaaa" ParentLoadCarrierIdentity="aaaaaaaaaaaaaaaaaaaaaaaaaaaaaaaaaaa"/>
				<LoadCarrier ShipLocationAddress="aaaaaaaaaaaa" Address2="aaaaaaaaaaaaaaaaaaaaaaaaaaaaaaaaaaa" AreaIdentity="aaa" LocationAddress="aaaaaaaaaaaa" TotalVolume="1234567891.123456" Phone="aaaaaaaaaaaaaaaaaaaaaaaaaaaaaaaaaaa" LoadCarrierTypeDescription="aaaaaaaaaaaaaaaaaaaaaaaaaaaaaaaaaaa" ShipAreaIdentity="aaa" City="aaaaaaaaaaaaaaaaaaaaaaaaaaaaaaaaaaa" Address="aaaaaaaaaaaaaaaaaaaaaaaaaaaaaaaaaaa" Name="aaaaaaaaaaaaaaaaaaaaaaaaaaaaaaaaaaa" LoadCarrierIdentity="aaaaaaaaaaaaaaaaaaaaaaaaaaaaaaaaaaa" PartyIdentity="aaaaaaaaaaaaaaaaaaaaaaaaaaaaaaaaaaa" ZipCode="aaaaaaaaaaaa" TotalWeight="1234567891.123456" StopSequence="12345" EstimatedArrivalTime="2001-12-17T09:30:47.0Z" ProductTransportTypeText="aaaaaaaaaaaaaaaaaaaaaaaaaaaaaaaaaaa" ParentLoadCarrierIdentity="aaaaaaaaaaaaaaaaaaaaaaaaaaaaaaaaaaa"/>
				<LoadCarrier ShipLocationAddress="aaaaaaaaaaaa" Address2="aaaaaaaaaaaaaaaaaaaaaaaaaaaaaaaaaaa" AreaIdentity="aaa" LocationAddress="aaaaaaaaaaaa" TotalVolume="1234567891.123456" Phone="aaaaaaaaaaaaaaaaaaaaaaaaaaaaaaaaaaa" LoadCarrierTypeDescription="aaaaaaaaaaaaaaaaaaaaaaaaaaaaaaaaaaa" ShipAreaIdentity="aaa" City="aaaaaaaaaaaaaaaaaaaaaaaaaaaaaaaaaaa" Address="aaaaaaaaaaaaaaaaaaaaaaaaaaaaaaaaaaa" Name="aaaaaaaaaaaaaaaaaaaaaaaaaaaaaaaaaaa" LoadCarrierIdentity="aaaaaaaaaaaaaaaaaaaaaaaaaaaaaaaaaaa" PartyIdentity="aaaaaaaaaaaaaaaaaaaaaaaaaaaaaaaaaaa" ZipCode="aaaaaaaaaaaa" TotalWeight="1234567891.123456" StopSequence="12345" EstimatedArrivalTime="2001-12-17T09:30:47.0Z" ProductTransportTypeText="aaaaaaaaaaaaaaaaaaaaaaaaaaaaaaaaaaa" ParentLoadCarrierIdentity="aaaaaaaaaaaaaaaaaaaaaaaaaaaaaaaaaaa"/>
				<LoadCarrier ShipLocationAddress="aaaaaaaaaaaa" Address2="aaaaaaaaaaaaaaaaaaaaaaaaaaaaaaaaaaa" AreaIdentity="aaa" LocationAddress="aaaaaaaaaaaa" TotalVolume="1234567891.123456" Phone="aaaaaaaaaaaaaaaaaaaaaaaaaaaaaaaaaaa" LoadCarrierTypeDescription="aaaaaaaaaaaaaaaaaaaaaaaaaaaaaaaaaaa" ShipAreaIdentity="aaa" City="aaaaaaaaaaaaaaaaaaaaaaaaaaaaaaaaaaa" Address="aaaaaaaaaaaaaaaaaaaaaaaaaaaaaaaaaaa" Name="aaaaaaaaaaaaaaaaaaaaaaaaaaaaaaaaaaa" LoadCarrierIdentity="aaaaaaaaaaaaaaaaaaaaaaaaaaaaaaaaaaa" PartyIdentity="aaaaaaaaaaaaaaaaaaaaaaaaaaaaaaaaaaa" ZipCode="aaaaaaaaaaaa" TotalWeight="1234567891.123456" StopSequence="12345" EstimatedArrivalTime="2001-12-17T09:30:47.0Z" ProductTransportTypeText="aaaaaaaaaaaaaaaaaaaaaaaaaaaaaaaaaaa" ParentLoadCarrierIdentity="aaaaaaaaaaaaaaaaaaaaaaaaaaaaaaaaaaa"/>
				<LoadCarrier ShipLocationAddress="aaaaaaaaaaaa" Address2="aaaaaaaaaaaaaaaaaaaaaaaaaaaaaaaaaaa" AreaIdentity="aaa" LocationAddress="aaaaaaaaaaaa" TotalVolume="1234567891.123456" Phone="aaaaaaaaaaaaaaaaaaaaaaaaaaaaaaaaaaa" LoadCarrierTypeDescription="aaaaaaaaaaaaaaaaaaaaaaaaaaaaaaaaaaa" ShipAreaIdentity="aaa" City="aaaaaaaaaaaaaaaaaaaaaaaaaaaaaaaaaaa" Address="aaaaaaaaaaaaaaaaaaaaaaaaaaaaaaaaaaa" Name="aaaaaaaaaaaaaaaaaaaaaaaaaaaaaaaaaaa" LoadCarrierIdentity="aaaaaaaaaaaaaaaaaaaaaaaaaaaaaaaaaaa" PartyIdentity="aaaaaaaaaaaaaaaaaaaaaaaaaaaaaaaaaaa" ZipCode="aaaaaaaaaaaa" TotalWeight="1234567891.123456" StopSequence="12345" EstimatedArrivalTime="2001-12-17T09:30:47.0Z" ProductTransportTypeText="aaaaaaaaaaaaaaaaaaaaaaaaaaaaaaaaaaa" ParentLoadCarrierIdentity="aaaaaaaaaaaaaaaaaaaaaaaaaaaaaaaaaaa"/>
				<LoadCarrier ShipLocationAddress="aaaaaaaaaaaa" Address2="aaaaaaaaaaaaaaaaaaaaaaaaaaaaaaaaaaa" AreaIdentity="aaa" LocationAddress="aaaaaaaaaaaa" TotalVolume="1234567891.123456" Phone="aaaaaaaaaaaaaaaaaaaaaaaaaaaaaaaaaaa" LoadCarrierTypeDescription="aaaaaaaaaaaaaaaaaaaaaaaaaaaaaaaaaaa" ShipAreaIdentity="aaa" City="aaaaaaaaaaaaaaaaaaaaaaaaaaaaaaaaaaa" Address="aaaaaaaaaaaaaaaaaaaaaaaaaaaaaaaaaaa" Name="aaaaaaaaaaaaaaaaaaaaaaaaaaaaaaaaaaa" LoadCarrierIdentity="aaaaaaaaaaaaaaaaaaaaaaaaaaaaaaaaaaa" PartyIdentity="aaaaaaaaaaaaaaaaaaaaaaaaaaaaaaaaaaa" ZipCode="aaaaaaaaaaaa" TotalWeight="1234567891.123456" StopSequence="12345" EstimatedArrivalTime="2001-12-17T09:30:47.0Z" ProductTransportTypeText="aaaaaaaaaaaaaaaaaaaaaaaaaaaaaaaaaaa" ParentLoadCarrierIdentity="aaaaaaaaaaaaaaaaaaaaaaaaaaaaaaaaaaa"/>
				<LoadCarrier ShipLocationAddress="aaaaaaaaaaaa" Address2="aaaaaaaaaaaaaaaaaaaaaaaaaaaaaaaaaaa" AreaIdentity="aaa" LocationAddress="aaaaaaaaaaaa" TotalVolume="1234567891.123456" Phone="aaaaaaaaaaaaaaaaaaaaaaaaaaaaaaaaaaa" LoadCarrierTypeDescription="aaaaaaaaaaaaaaaaaaaaaaaaaaaaaaaaaaa" ShipAreaIdentity="aaa" City="aaaaaaaaaaaaaaaaaaaaaaaaaaaaaaaaaaa" Address="aaaaaaaaaaaaaaaaaaaaaaaaaaaaaaaaaaa" Name="aaaaaaaaaaaaaaaaaaaaaaaaaaaaaaaaaaa" LoadCarrierIdentity="aaaaaaaaaaaaaaaaaaaaaaaaaaaaaaaaaaa" PartyIdentity="aaaaaaaaaaaaaaaaaaaaaaaaaaaaaaaaaaa" ZipCode="aaaaaaaaaaaa" TotalWeight="1234567891.123456" StopSequence="12345" EstimatedArrivalTime="2001-12-17T09:30:47.0Z" ProductTransportTypeText="aaaaaaaaaaaaaaaaaaaaaaaaaaaaaaaaaaa" ParentLoadCarrierIdentity="aaaaaaaaaaaaaaaaaaaaaaaaaaaaaaaaaaa"/>
				<ShipToParty ShipToPartyIdentity="aaaaaaaaaaaaaaaaaaaaaaaaaaaaaaaaaaa" DepartureIdentity="aaaaaaaaaaaaaaaaaaaaaaaaaaaaaaaaaaa"/>
				<ShipToParty ShipToPartyIdentity="aaaaaaaaaaaaaaaaaaaaaaaaaaaaaaaaaaa" DepartureIdentity="aaaaaaaaaaaaaaaaaaaaaaaaaaaaaaaaaaa"/>
				<ShipToParty ShipToPartyIdentity="aaaaaaaaaaaaaaaaaaaaaaaaaaaaaaaaaaa" DepartureIdentity="aaaaaaaaaaaaaaaaaaaaaaaaaaaaaaaaaaa"/>
				<ShipToParty ShipToPartyIdentity="aaaaaaaaaaaaaaaaaaaaaaaaaaaaaaaaaaa" DepartureIdentity="aaaaaaaaaaaaaaaaaaaaaaaaaaaaaaaaaaa"/>
				<ShipToParty ShipToPartyIdentity="aaaaaaaaaaaaaaaaaaaaaaaaaaaaaaaaaaa" DepartureIdentity="aaaaaaaaaaaaaaaaaaaaaaaaaaaaaaaaaaa"/>
				<ShipToParty ShipToPartyIdentity="aaaaaaaaaaaaaaaaaaaaaaaaaaaaaaaaaaa" DepartureIdentity="aaaaaaaaaaaaaaaaaaaaaaaaaaaaaaaaaaa"/>
				<ShipToParty ShipToPartyIdentity="aaaaaaaaaaaaaaaaaaaaaaaaaaaaaaaaaaa" DepartureIdentity="aaaaaaaaaaaaaaaaaaaaaaaaaaaaaaaaaaa"/>
				<ShipToParty ShipToPartyIdentity="aaaaaaaaaaaaaaaaaaaaaaaaaaaaaaaaaaa" DepartureIdentity="aaaaaaaaaaaaaaaaaaaaaaaaaaaaaaaaaaa"/>